<config xmlns:xsi="http://www.w3.org/2001/XMLSchema-instance"
        xsi:noNamespaceSchemaLocation="urn:magento:module:MageSuite_Changelog:etc/changelog.xsd">
    <module
        id="Title"
        name="Title"
        description="$description"
        url="$url">
        <changelog>
            <tag version="1.0.0" date="2022-01-08">
                <entry>
                    <type>INIT</type>
                    <overview>Initial release</overview>
                    <description></description>
                </entry>
            </tag>
        </changelog>
    </module>
</config>
