<config xmlns:xsi="http://www.w3.org/2001/XMLSchema-instance" xsi:noNamespaceSchemaLocation="urn:magento:module:MageSuite_Changelog:etc/changelog.xsd">
    <module
        id="MageSuite_Changelog"
        name="Magesuite_Changelog"
        description="This module allows to gather and display changelog entries from all compatible extensions."
        url="https://github.com/magesuite/changelog">
            <changelog>
                <tag version="1.0.0" date="2021-03-12">
                    <entry>
                        <type>INIT</type>
                        <overview>Initial release</overview>
                    </entry>
                </tag>
                <tag version="1.0.1" date="2022-05-11">
                    <entry>
                        <type>FIX</type>
                        <overview>Adjusted code to be compatible with php7</overview>
                    </entry>
                </tag>
                <tag version="1.0.2" date="2022-05-17">
                    <entry>
                        <type>FIX</type>
                        <overview>Refactored xsd file to be less strict</overview>
                    </entry>
                    <entry>
                        <type>FIX</type>
                        <overview>Fixed obtaining list of nodes from XML</overview>
                    </entry>
                </tag>
                <tag version="1.0.3" date="2022-05-18">
                    <entry>
                        <type>FIX</type>
                        <overview>Corrected integration test to support different order of extensions.</overview>
                    </entry>
                </tag>
            </changelog>
    </module>
</config>
